{
  "process_id": "feature_full",
  "version": "1.0.0",
  "name": "Feature Development (Full)",
  "description": "Full feature development process with all phases. Use for new features with business context, architecture, and full validation. Includes BC/AC analysis, planning, implementation, infrastructure validation, QA testing, and deployment.",
  "type": "feature_development",
  "phases": [
    {
      "id": "RELEASE",
      "skip_allowed": false,
      "template": "RELEASE_TEMPLATE.md",
      "validators": [
        "release_state_valid_schema",
        "release_has_problem",
        "release_has_scope"
      ]
    },
    {
      "id": "BC_DELTA",
      "skip_allowed": false,
      "template": "BC_DELTA_TEMPLATE.md",
      "validators": [
        "bc_has_goals",
        "bc_has_actors",
        "bc_has_scenarios"
      ],
      "approval": {
        "required": true,
        "role": "product_owner"
      }
    },
    {
      "id": "AC_DELTA",
      "skip_allowed": false,
      "template": "AC_DELTA_TEMPLATE.md",
      "validators": [
        "ac_has_use_cases",
        "ac_based_on_bc"
      ],
      "approval": {
        "required": true,
        "role": "tech_lead"
      }
    },
    {
      "id": "PLAN_FINALIZE",
      "skip_allowed": false,
      "template": "PLAN_FINALIZE_TEMPLATE.md",
      "validators": [
        "plan_has_tasks",
        "tasks_estimated"
      ],
      "approval": {
        "required": true,
        "role": "team"
      }
    },
    {
      "id": "PC",
      "skip_allowed": false,
      "template": "PC_CONTEXT_TEMPLATE.md",
      "validators": [
        "pc_has_implementation",
        "pc_has_5_ics"
      ]
    },
    {
      "id": "IC",
      "skip_allowed": false,
      "template": "IC_TEMPLATE.md",
      "validators": [
        "all_ics_validated",
        "no_p0_violations"
      ]
    },
    {
      "id": "QA",
      "skip_allowed": false,
      "template": "QA_TESTING_TEMPLATE.md",
      "validators": [
        "qa_tests_passed",
        "qa_coverage_met"
      ],
      "approval": {
        "required": true,
        "role": "qa_lead"
      }
    },
    {
      "id": "APPLY_DELTAS",
      "skip_allowed": false
    },
    {
      "id": "DEPLOY",
      "skip_allowed": false
    }
  ],
  "nodes": {
    "sccu:workflow-engine": "^1.0.0",
    "sccu:workflow-phase-templates": "^1.0.0",
    "sccu:workflow-process-definitions": "^1.0.0",
    "sccu:workflow-mcp-server": "^1.0.0",
    "sccu:workflow-automation-skills": "^1.0.0",
    "sccu:architecture-domains": "^1.0.0"
  }
}
