{
  "process_id": "bugfix_simple",
  "version": "1.0.0",
  "name": "Bugfix (Simple)",
  "description": "Simplified process for bug fixes. Skips BC/AC analysis, goes straight to implementation: PC → IC → QA → DEPLOY. Use for straightforward bug fixes that don't require business context analysis.",
  "type": "bugfix",
  "phases": [
    {
      "id": "RELEASE",
      "skip_allowed": false,
      "template": "RELEASE_TEMPLATE.md",
      "validators": [
        "release_state_valid_schema",
        "release_has_problem",
        "release_has_scope"
      ]
    },
    {
      "id": "PC",
      "skip_allowed": false,
      "template": "PC_CONTEXT_TEMPLATE.md",
      "validators": [
        "pc_has_implementation",
        "pc_has_5_ics"
      ]
    },
    {
      "id": "IC",
      "skip_allowed": false,
      "template": "IC_TEMPLATE.md",
      "validators": [
        "all_ics_validated",
        "no_p0_violations"
      ]
    },
    {
      "id": "QA",
      "skip_allowed": false,
      "template": "QA_TESTING_TEMPLATE.md",
      "validators": [
        "qa_tests_passed",
        "qa_coverage_met"
      ],
      "approval": {
        "required": true,
        "role": "qa_lead"
      }
    },
    {
      "id": "DEPLOY",
      "skip_allowed": false
    }
  ],
  "nodes": {
    "sccu:workflow-engine": "^1.0.0",
    "sccu:workflow-phase-templates": "^1.0.0",
    "sccu:workflow-process-definitions": "^1.0.0",
    "sccu:workflow-mcp-server": "^1.0.0",
    "sccu:workflow-automation-skills": "^1.0.0"
  }
}
