{
  "process_id": "feature_full_auto",
  "version": "1.0.0",
  "name": "Feature Development (Full, Autonomous)",
  "description": "Full feature development process with NO human approvals. All phases execute automatically. Use ONLY when human has pre-approved the entire feature scope and trusts LLM to make all decisions.",
  "type": "feature_development",
  "phases": [
    {
      "id": "RELEASE",
      "skip_allowed": false,
      "template": "RELEASE_TEMPLATE.md",
      "validators": [
        "release_state_valid_schema",
        "release_has_problem",
        "release_has_scope"
      ]
    },
    {
      "id": "BC_DELTA",
      "skip_allowed": false,
      "template": "BC_DELTA_TEMPLATE.md",
      "validators": [
        "bc_has_goals",
        "bc_has_actors",
        "bc_has_scenarios"
      ]
    },
    {
      "id": "AC_DELTA",
      "skip_allowed": false,
      "template": "AC_DELTA_TEMPLATE.md",
      "validators": [
        "ac_has_use_cases",
        "ac_based_on_bc"
      ]
    },
    {
      "id": "PLAN_FINALIZE",
      "skip_allowed": false,
      "template": "PLAN_FINALIZE_TEMPLATE.md",
      "validators": [
        "plan_has_tasks",
        "tasks_estimated"
      ]
    },
    {
      "id": "PC",
      "skip_allowed": false,
      "template": "PC_CONTEXT_TEMPLATE.md",
      "validators": [
        "pc_has_implementation",
        "pc_has_5_ics"
      ]
    },
    {
      "id": "IC",
      "skip_allowed": false,
      "template": "IC_TEMPLATE.md",
      "validators": [
        "all_ics_validated",
        "no_p0_violations"
      ]
    },
    {
      "id": "QA",
      "skip_allowed": false,
      "template": "QA_TESTING_TEMPLATE.md",
      "validators": [
        "qa_tests_passed",
        "qa_coverage_met"
      ]
    },
    {
      "id": "APPLY_DELTAS",
      "skip_allowed": false
    },
    {
      "id": "DEPLOY",
      "skip_allowed": false
    }
  ],
  "nodes": {
    "sccu:workflow-engine": "^1.0.0",
    "sccu:workflow-phase-templates": "^1.0.0",
    "sccu:workflow-process-definitions": "^1.0.0",
    "sccu:workflow-mcp-server": "^1.0.0",
    "sccu:workflow-automation-skills": "^1.0.0",
    "sccu:architecture-domains": "^1.0.0"
  }
}
